[
  {
    "abstract": "Synthetic offline fixture: corrective retrieval augmented generation detects weak documents and uses a retrieval correction step.",
    "access": {
      "content_sha256": "01e834adf9e2f70d7ea89d8236337f3331ea061b3f387ed031a88c293f8089a6",
      "content_type": "abstract",
      "failure_type": null,
      "page_count": null,
      "size_bytes": 129,
      "source_url": "https://www.semanticscholar.org/paper/0000000000000000000000000000000000000007",
      "status": "available"
    },
    "analysis": {
      "agent_interpretation": [],
      "datasets": [],
      "extraction_uncertainty": "Offline mock; not a live paper analysis.",
      "key_results": [
        "Offline fixture evidence for Offline Fixture Corrective Retrieval Study 07"
      ],
      "limitations": [
        "Not a live scholarly analysis"
      ],
      "methodology": "Offline mock adapter",
      "metrics": [],
      "paper_claims": [
        {
          "claim": "Offline fixture evidence for Offline Fixture Corrective Retrieval Study 07",
          "claim_id": "offline-claim-001"
        }
      ],
      "rag_stages": [
        "offline_fixture"
      ],
      "research_objective": "Offline fixture objective"
    },
    "authors": [
      "Test Author 07"
    ],
    "deduplication": {
      "merged_records": [],
      "unresolved_candidates": []
    },
    "identifiers": {
      "arxiv_id": null,
      "doi": "10.5555/offline.07",
      "semantic_scholar_paper_id": "0000000000000000000000000000000000000007"
    },
    "language": "en",
    "normalized_title": "offline fixture corrective retrieval study 07",
    "publication_type": "conference-paper",
    "record_id": "paper-fb76496e560e",
    "source_records": [
      {
        "query": "offline fixture",
        "rank": 7,
        "response_identifier": "0000000000000000000000000000000000000007",
        "retrieved_at": "2026-09-16T04:01:29.535745+00:00",
        "source": "semantic_scholar",
        "source_url": "https://www.semanticscholar.org/paper/0000000000000000000000000000000000000007"
      }
    ],
    "title": "Offline Fixture Corrective Retrieval Study 07",
    "validation": {
      "checks": [
        {
          "identifier": "doi",
          "status": "syntax_valid",
          "value": "10.5555/offline.07"
        },
        {
          "identifier": "semantic_scholar_paper_id",
          "status": "syntax_valid",
          "value": "0000000000000000000000000000000000000007"
        },
        {
          "identifier": "doi",
          "method": "condition_source_boundary",
          "status": "syntax_valid_only",
          "value": "10.5555/offline.07"
        },
        {
          "identifier": "semantic_scholar_paper_id",
          "method": "official_semantic_scholar_search_response",
          "status": "verified",
          "value": "0000000000000000000000000000000000000007"
        }
      ],
      "eligible": true,
      "status": "offline_fixture"
    },
    "venue": "FixtureConf",
    "year": 2024
  },
  {
    "abstract": "Synthetic offline fixture: a cross encoder reranker is compared with dense retrieval for retrieval augmented generation.",
    "access": {
      "content_sha256": "d526c68c02e0c82d82ddeec9345a7fdddfe6eaf8487642539509eedb7629fc7a",
      "content_type": "abstract",
      "failure_type": null,
      "page_count": null,
      "size_bytes": 120,
      "source_url": "https://www.semanticscholar.org/paper/0000000000000000000000000000000000000005",
      "status": "available"
    },
    "analysis": {
      "agent_interpretation": [],
      "datasets": [],
      "extraction_uncertainty": "Offline mock; not a live paper analysis.",
      "key_results": [
        "Offline fixture evidence for Offline Fixture Cross Encoder Reranker Study 05"
      ],
      "limitations": [
        "Not a live scholarly analysis"
      ],
      "methodology": "Offline mock adapter",
      "metrics": [],
      "paper_claims": [
        {
          "claim": "Offline fixture evidence for Offline Fixture Cross Encoder Reranker Study 05",
          "claim_id": "offline-claim-002"
        }
      ],
      "rag_stages": [
        "offline_fixture"
      ],
      "research_objective": "Offline fixture objective"
    },
    "authors": [
      "Test Author 05"
    ],
    "deduplication": {
      "merged_records": [],
      "unresolved_candidates": []
    },
    "identifiers": {
      "arxiv_id": null,
      "doi": "10.5555/offline.05",
      "semantic_scholar_paper_id": "0000000000000000000000000000000000000005"
    },
    "language": "en",
    "normalized_title": "offline fixture cross encoder reranker study 05",
    "publication_type": "journal-article",
    "record_id": "paper-95dc9b4808a5",
    "source_records": [
      {
        "query": "offline fixture",
        "rank": 5,
        "response_identifier": "0000000000000000000000000000000000000005",
        "retrieved_at": "2026-09-16T04:01:29.535745+00:00",
        "source": "semantic_scholar",
        "source_url": "https://www.semanticscholar.org/paper/0000000000000000000000000000000000000005"
      }
    ],
    "title": "Offline Fixture Cross Encoder Reranker Study 05",
    "validation": {
      "checks": [
        {
          "identifier": "doi",
          "status": "syntax_valid",
          "value": "10.5555/offline.05"
        },
        {
          "identifier": "semantic_scholar_paper_id",
          "status": "syntax_valid",
          "value": "0000000000000000000000000000000000000005"
        },
        {
          "identifier": "doi",
          "method": "condition_source_boundary",
          "status": "syntax_valid_only",
          "value": "10.5555/offline.05"
        },
        {
          "identifier": "semantic_scholar_paper_id",
          "method": "official_semantic_scholar_search_response",
          "status": "verified",
          "value": "0000000000000000000000000000000000000005"
        }
      ],
      "eligible": true,
      "status": "offline_fixture"
    },
    "venue": "FixtureConf",
    "year": 2021
  },
  {
    "abstract": "Synthetic offline fixture: Self-RAG uses self reflection to retrieve and critique generations for factuality and citation quality.",
    "access": {
      "content_sha256": "8ea878a6a5c5430d963460bb54feb05ef6980e6a9dc585a1d9943aef53a7e4b6",
      "content_type": "abstract",
      "failure_type": null,
      "page_count": null,
      "size_bytes": 130,
      "source_url": "https://www.semanticscholar.org/paper/0000000000000000000000000000000000000009",
      "status": "available"
    },
    "analysis": {
      "agent_interpretation": [],
      "datasets": [],
      "extraction_uncertainty": "Offline mock; not a live paper analysis.",
      "key_results": [
        "Offline fixture evidence for Offline Fixture Self RAG Study 09"
      ],
      "limitations": [
        "Not a live scholarly analysis"
      ],
      "methodology": "Offline mock adapter",
      "metrics": [],
      "paper_claims": [
        {
          "claim": "Offline fixture evidence for Offline Fixture Self RAG Study 09",
          "claim_id": "offline-claim-003"
        }
      ],
      "rag_stages": [
        "offline_fixture"
      ],
      "research_objective": "Offline fixture objective"
    },
    "authors": [
      "Test Author 09"
    ],
    "deduplication": {
      "merged_records": [],
      "unresolved_candidates": []
    },
    "identifiers": {
      "arxiv_id": null,
      "doi": "10.5555/offline.09",
      "semantic_scholar_paper_id": "0000000000000000000000000000000000000009"
    },
    "language": "en",
    "normalized_title": "offline fixture self rag study 09",
    "publication_type": "conference-paper",
    "record_id": "paper-9230a0fd10a1",
    "source_records": [
      {
        "query": "offline fixture",
        "rank": 9,
        "response_identifier": "0000000000000000000000000000000000000009",
        "retrieved_at": "2026-09-16T04:01:29.535745+00:00",
        "source": "semantic_scholar",
        "source_url": "https://www.semanticscholar.org/paper/0000000000000000000000000000000000000009"
      }
    ],
    "title": "Offline Fixture Self RAG Study 09",
    "validation": {
      "checks": [
        {
          "identifier": "doi",
          "status": "syntax_valid",
          "value": "10.5555/offline.09"
        },
        {
          "identifier": "semantic_scholar_paper_id",
          "status": "syntax_valid",
          "value": "0000000000000000000000000000000000000009"
        },
        {
          "identifier": "doi",
          "method": "condition_source_boundary",
          "status": "syntax_valid_only",
          "value": "10.5555/offline.09"
        },
        {
          "identifier": "semantic_scholar_paper_id",
          "method": "official_semantic_scholar_search_response",
          "status": "verified",
          "value": "0000000000000000000000000000000000000009"
        }
      ],
      "eligible": true,
      "status": "offline_fixture"
    },
    "venue": "FixtureConf",
    "year": 2023
  },
  {
    "abstract": "Synthetic offline fixture: adaptive retrieval chooses retrieval depth for a retrieval augmented generation system and measures cost.",
    "access": {
      "content_sha256": "0c8dc1f10d4def08976ea375fe6cdde5a6e826c548b68756f6363cdf5e175ae7",
      "content_type": "abstract",
      "failure_type": null,
      "page_count": null,
      "size_bytes": 132,
      "source_url": "https://www.semanticscholar.org/paper/000000000000000000000000000000000000000b",
      "status": "available"
    },
    "analysis": {
      "agent_interpretation": [],
      "datasets": [],
      "extraction_uncertainty": "Offline mock; not a live paper analysis.",
      "key_results": [
        "Offline fixture evidence for Offline Fixture Adaptive Retrieval Study 11"
      ],
      "limitations": [
        "Not a live scholarly analysis"
      ],
      "methodology": "Offline mock adapter",
      "metrics": [],
      "paper_claims": [
        {